{
  "storyId": "noah-s-ark",
  "input": {
    "title": "Noah's Ark",
    "summary": "Noah builds an ark to save his family and animals from a great flood",
    "keyMoments": [
      "God tells Noah to build an ark",
      "Animals enter the ark two by two",
      "The great flood covers the earth",
      "The dove returns with an olive branch",
      "Rainbow promise"
    ]
  },
  "steps": {
    "narrative": {
      "systemPrompt": "<role>\nYou are a biblical storyteller creating narratives for comic book adaptation.\n</role>\n\n<task>\nWrite a complete story narrative based on the provided story details.\n</task>\n\n<constraints>\n- The narrative must have a complete story arc: setup, conflict, and resolution.\n- Aim for approximately 150 words, prioritizing completeness over strict word count.\n- If the story is part of a larger biblical narrative, this episode must still have its own complete arc.\n- Use simple vocabulary.\n- Do not use em dashes.\n</constraints>\n\n<output_format>\nOutput the narrative as continuous prose.\n</output_format>\n",
      "userMessage": "Write the Bible story narrative for:\n\nTitle: Noah's Ark\nSummary: Noah builds an ark to save his family and animals from a great flood\nKey moments to include: God tells Noah to build an ark, Animals enter the ark two by two, The great flood covers the earth, The dove returns with an olive branch, Rainbow promise",
      "response": "In a time when the world had grown wicked and full of violence, God chose Noah, a righteous man, to carry out His plan. God spoke to Noah, saying, “Build an ark from gopher wood. Make it a refuge for your family and the animals.” Obeying without question, Noah gathered his wife, sons, and their families. Together, they labored day and night, following God’s exact instructions.\n\nAs the ark neared completion, pairs of every animal began to arrive. Birds and beasts entered the ark two by two, guided by God’s hand. Soon after, the skies darkened, and the rains began to fall, covering the earth in a great flood. For forty days and nights, the waters rose until even the highest mountains were submerged.\n\nWhen the rains ceased, Noah released a dove to search for land. It returned with a fresh olive branch, a sign of hope. As the waters receded, the ark came to rest on Mount Ararat. Stepping out under clear skies, Noah saw a magnificent rainbow stretched across the heavens. God promised, “Never again will I flood the earth.” The rainbow stood as an eternal sign of this covenant between God and all living creatures."
    },
    "planning": {
      "systemPrompt": "<role>\nYou are a comic book page planner. You break narratives into visual pages and panels.\n</role>\n\n<task>\nBreak the narrative into pages and define panels.\n\n1. Identify major story moments (beats) where the narrative naturally segments\n2. Divide into pages based on these moments\n3. For each page:\n- Extract the sentences from the narrative covering that segment as narration\n- For each panel, describe the visual moment/action shown in detail\n- For each panel, add a visual anchor: emphasis or intent hint that guides image generation\n</task>\n\n<constraints>\n- 3-5 pages total (flexible based on story needs)\n- 3 panels per page\n- Page narration: ~30-40 words extracted from the narrative (do not rewrite)\n- Each panel description: one visual moment/action, described in detail\n- Panels must advance the story\n- Visual anchor: what should be emphasized visually (scale, emotion, contrast, etc.)\n</constraints>\n\n<output_format>\nReturn structured JSON matching the schema.\n</output_format>\n",
      "userMessage": "Break this narrative into comic book pages and panels:\n\nIn a time when the world had grown wicked and full of violence, God chose Noah, a righteous man, to carry out His plan. God spoke to Noah, saying, “Build an ark from gopher wood. Make it a refuge for your family and the animals.” Obeying without question, Noah gathered his wife, sons, and their families. Together, they labored day and night, following God’s exact instructions.\n\nAs the ark neared completion, pairs of every animal began to arrive. Birds and beasts entered the ark two by two, guided by God’s hand. Soon after, the skies darkened, and the rains began to fall, covering the earth in a great flood. For forty days and nights, the waters rose until even the highest mountains were submerged.\n\nWhen the rains ceased, Noah released a dove to search for land. It returned with a fresh olive branch, a sign of hope. As the waters receded, the ark came to rest on Mount Ararat. Stepping out under clear skies, Noah saw a magnificent rainbow stretched across the heavens. God promised, “Never again will I flood the earth.” The rainbow stood as an eternal sign of this covenant between God and all living creatures.",
      "response": [
        {
          "pageNumber": 1,
          "title": "Chosen by God",
          "narration": "In a time when the world had grown wicked and full of violence, God chose Noah, a righteous man, to carry out His plan.",
          "panels": [
            {
              "panel": 1,
              "moment": "God speaks to Noah, surrounded by the chaos of a wicked world.",
              "visualAnchor": "Contrast between divine light and surrounding darkness."
            },
            {
              "panel": 2,
              "moment": "Noah listens intently, showing determination and resolve.",
              "visualAnchor": "Noah’s focused expression."
            },
            {
              "panel": 3,
              "moment": "Noah shares God’s message with his family.",
              "visualAnchor": "Family unity and support."
            }
          ]
        },
        {
          "pageNumber": 2,
          "title": "Building the Ark",
          "narration": "God spoke to Noah, saying, “Build an ark from gopher wood. Make it a refuge for your family and the animals.”",
          "panels": [
            {
              "panel": 1,
              "moment": "Noah and his family begin constructing the ark.",
              "visualAnchor": "The scale of the ark in progress."
            },
            {
              "panel": 2,
              "moment": "Detailed work on the ark, showing craftsmanship and teamwork.",
              "visualAnchor": "Hands working on wood, emphasizing precision."
            },
            {
              "panel": 3,
              "moment": "The partially completed ark towers over the landscape.",
              "visualAnchor": "The ark's impressive size."
            }
          ]
        },
        {
          "pageNumber": 3,
          "title": "Guided by God",
          "narration": "As the ark neared completion, pairs of every animal began to arrive. Birds and beasts entered the ark two by two, guided by God’s hand.",
          "panels": [
            {
              "panel": 1,
              "moment": "Animals approaching the ark, led by an unseen force.",
              "visualAnchor": "Diverse animals in harmony."
            },
            {
              "panel": 2,
              "moment": "Close-up of a lion and lamb entering the ark together.",
              "visualAnchor": "Peaceful animal interactions."
            },
            {
              "panel": 3,
              "moment": "Noah welcoming the animals, his face reflecting awe and gratitude.",
              "visualAnchor": "Noah’s expression of wonder."
            }
          ]
        },
        {
          "pageNumber": 4,
          "title": "The Great Flood",
          "narration": "Soon after, the skies darkened, and the rains began to fall, covering the earth in a great flood. For forty days and nights, the waters rose.",
          "panels": [
            {
              "panel": 1,
              "moment": "Dark clouds gathering, a storm brewing over the ark.",
              "visualAnchor": "Dramatic storm clouds."
            },
            {
              "panel": 2,
              "moment": "The ark amidst rising waters, waves crashing against it.",
              "visualAnchor": "Powerful, tumultuous waves."
            },
            {
              "panel": 3,
              "moment": "View from inside the ark, animals huddled together as rain pours down.",
              "visualAnchor": "Comfort within chaos."
            }
          ]
        },
        {
          "pageNumber": 5,
          "title": "A New Beginning",
          "narration": "When the rains ceased, Noah released a dove. It returned with an olive branch, a sign of hope. The ark rested on Mount Ararat.",
          "panels": [
            {
              "panel": 1,
              "moment": "Noah releasing the dove from the ark, looking hopeful.",
              "visualAnchor": "Symbolic freedom and peace."
            },
            {
              "panel": 2,
              "moment": "The dove returns with an olive branch, a symbol of new life.",
              "visualAnchor": "Gentle, hopeful imagery of the dove."
            },
            {
              "panel": 3,
              "moment": "Noah and his family stepping onto dry land, the rainbow overhead.",
              "visualAnchor": "The vibrant rainbow symbolizing God’s promise."
            }
          ]
        }
      ]
    },
    "prompts": {
      "systemPrompt": "<role>\nYou are an expert visual prompt engineer specializing in comic book image generation.\n</role>\n\n<task>\nGenerate image prompts for comic book pages based on the provided page/panel structure.\n1. Define character appearances\n2. For each page, fill the panel blocks (provided below) and assemble into one natural language prompt\n</task>\n\n<constraints>\n- When defining characters appearances, keep it to physical appearance only (hair, clothing, features) and ~10-20 words max\n- Keep panels simple (3-5 core visual elements)\n- Assemble blocks into natural flowing sentences\n</constraints>\n\n<knowledge>\nBLOCK SYSTEM:\nPrompts are built from modular blocks representing scene aspects:\n- Subjects: characters, appearance, actions\n- Environment: setting, location\n- Composition: shot type, camera angle\n- Lighting: light type, quality\n\nASSEMBLY RULE:\nCombine block values into natural, flowing sentences. Don't list blocks separately.\n- ❌ \"Young boy, dark hair, tunic, basket, camp\"\n- ✅ \"A young boy with dark hair in a simple tunic carries a basket into the camp\"\n\nVISUAL-ONLY PRINCIPLE:\nDescribe only physical, camera-visible elements. Avoid abstract interpretations.\n- ❌ \"intimidating presence\" (abstract)\n- ✅ \"towering figure with furrowed brow\" (visible)\n</knowledge>\n\n<blocks>\nPAGE-LEVEL BLOCKS (apply to each page):\n- medium.type = \"comic book page\"\n- layout.panelCount = \"3\"\n- layout.panelArrangement = \"vertical\"\n- comicStyle.artStyle = \"children's book illustration\"\n- comicStyle.inkStyle = \"bold ink lines\"\n- comicStyle.colorTreatment = \"flat colors\"\n- style.imageStyle = \"vibrant and accessible\"\n\nPANEL-LEVEL BLOCKS (fill for each panel):\n- scene.subjects.details = \"[character description]\"\n- scene.subjects.action = \"[what doing]\"\n- scene.environment.setting = \"[where]\"\n- composition.shot.type = \"[framing]\"\n- composition.shot.angle = \"[angle]\"\n- lighting.lightType = \"[lighting]\"\n</blocks>\n\n<output_format>\nOutput only page prompts, no character definitions.\nPAGE [N]\n[assembled prompt with page-level blocks followed by panel descriptions]\n</output_format>\n",
      "userMessage": "Generate image prompts from these panels using the blocks provided.\n\n[\n  {\n    \"pageNumber\": 1,\n    \"title\": \"Chosen by God\",\n    \"narration\": \"In a time when the world had grown wicked and full of violence, God chose Noah, a righteous man, to carry out His plan.\",\n    \"panels\": [\n      {\n        \"panel\": 1,\n        \"moment\": \"God speaks to Noah, surrounded by the chaos of a wicked world.\",\n        \"visualAnchor\": \"Contrast between divine light and surrounding darkness.\"\n      },\n      {\n        \"panel\": 2,\n        \"moment\": \"Noah listens intently, showing determination and resolve.\",\n        \"visualAnchor\": \"Noah’s focused expression.\"\n      },\n      {\n        \"panel\": 3,\n        \"moment\": \"Noah shares God’s message with his family.\",\n        \"visualAnchor\": \"Family unity and support.\"\n      }\n    ]\n  },\n  {\n    \"pageNumber\": 2,\n    \"title\": \"Building the Ark\",\n    \"narration\": \"God spoke to Noah, saying, “Build an ark from gopher wood. Make it a refuge for your family and the animals.”\",\n    \"panels\": [\n      {\n        \"panel\": 1,\n        \"moment\": \"Noah and his family begin constructing the ark.\",\n        \"visualAnchor\": \"The scale of the ark in progress.\"\n      },\n      {\n        \"panel\": 2,\n        \"moment\": \"Detailed work on the ark, showing craftsmanship and teamwork.\",\n        \"visualAnchor\": \"Hands working on wood, emphasizing precision.\"\n      },\n      {\n        \"panel\": 3,\n        \"moment\": \"The partially completed ark towers over the landscape.\",\n        \"visualAnchor\": \"The ark's impressive size.\"\n      }\n    ]\n  },\n  {\n    \"pageNumber\": 3,\n    \"title\": \"Guided by God\",\n    \"narration\": \"As the ark neared completion, pairs of every animal began to arrive. Birds and beasts entered the ark two by two, guided by God’s hand.\",\n    \"panels\": [\n      {\n        \"panel\": 1,\n        \"moment\": \"Animals approaching the ark, led by an unseen force.\",\n        \"visualAnchor\": \"Diverse animals in harmony.\"\n      },\n      {\n        \"panel\": 2,\n        \"moment\": \"Close-up of a lion and lamb entering the ark together.\",\n        \"visualAnchor\": \"Peaceful animal interactions.\"\n      },\n      {\n        \"panel\": 3,\n        \"moment\": \"Noah welcoming the animals, his face reflecting awe and gratitude.\",\n        \"visualAnchor\": \"Noah’s expression of wonder.\"\n      }\n    ]\n  },\n  {\n    \"pageNumber\": 4,\n    \"title\": \"The Great Flood\",\n    \"narration\": \"Soon after, the skies darkened, and the rains began to fall, covering the earth in a great flood. For forty days and nights, the waters rose.\",\n    \"panels\": [\n      {\n        \"panel\": 1,\n        \"moment\": \"Dark clouds gathering, a storm brewing over the ark.\",\n        \"visualAnchor\": \"Dramatic storm clouds.\"\n      },\n      {\n        \"panel\": 2,\n        \"moment\": \"The ark amidst rising waters, waves crashing against it.\",\n        \"visualAnchor\": \"Powerful, tumultuous waves.\"\n      },\n      {\n        \"panel\": 3,\n        \"moment\": \"View from inside the ark, animals huddled together as rain pours down.\",\n        \"visualAnchor\": \"Comfort within chaos.\"\n      }\n    ]\n  },\n  {\n    \"pageNumber\": 5,\n    \"title\": \"A New Beginning\",\n    \"narration\": \"When the rains ceased, Noah released a dove. It returned with an olive branch, a sign of hope. The ark rested on Mount Ararat.\",\n    \"panels\": [\n      {\n        \"panel\": 1,\n        \"moment\": \"Noah releasing the dove from the ark, looking hopeful.\",\n        \"visualAnchor\": \"Symbolic freedom and peace.\"\n      },\n      {\n        \"panel\": 2,\n        \"moment\": \"The dove returns with an olive branch, a symbol of new life.\",\n        \"visualAnchor\": \"Gentle, hopeful imagery of the dove.\"\n      },\n      {\n        \"panel\": 3,\n        \"moment\": \"Noah and his family stepping onto dry land, the rainbow overhead.\",\n        \"visualAnchor\": \"The vibrant rainbow symbolizing God’s promise.\"\n      }\n    ]\n  }\n]",
      "response": [
        {
          "pageNumber": 1,
          "prompt": "PAGE 1 In a children's book illustration style with bold ink lines and flat colors, this comic book page featuring three vertically arranged panels shows: First, a scene where from a high angle, divine light illuminates Noah, a bearded man with a flowing robe, amidst the darkness of a chaotic world. Next, in a medium shot, Noah’s focused face reflects determination as he listens intently, highlighted by soft ambient light. Finally, Noah stands with his family, their expressions unified and supportive, framed in a warm indoor setting from a waist-level angle."
        },
        {
          "pageNumber": 2,
          "prompt": "PAGE 2 In a vibrant and accessible children's book illustration style with bold ink lines and flat colors, the page is split into three vertical panels: Initially capturing a wide shot of Noah, his long sun-kissed hair and rugged attire visible, alongside his family beginning to construct the ark, casting long shadows under morning light. Then, an intimate close-up of hands, young and old, working meticulously on wood, craftsmanship evident in the details. Lastly, from a low perspective, the partially constructed ark looms large against the sky, its sheer size impressive under a clear afternoon light."
        },
        {
          "pageNumber": 3,
          "prompt": "PAGE 3 A comic book page with three vertical panels in a children's book illustration style, using bold ink lines and flat colors: The first panel presents a diverse group of animals, led by an unseen force, approaching the ark in harmony under soft diffused light. The second panel provides an intimate look at a lion and lamb entering the ark side by side, framed peacefully with gentle natural light. The final panel reveals a medium shot of Noah at the ark’s entrance, his expression full of awe and gratitude, captured under a serene, glowing light."
        },
        {
          "pageNumber": 4,
          "prompt": "PAGE 4 This vibrant comic book page, in a children's book style with bold ink lines and flat colors, is composed of three vertical panels: The first panel shows dark clouds gathering ominously over the ark, capturing the brewing storm from a high angle. Next, the violent scene of the ark amidst crashing waves is shown from a dramatic side view, the water emphasizing the ark's resilience. Finally, inside the ark, animals huddle together in a comforting atmosphere, seen from a soft, warm light that contrasts with the rain pouring down outside."
        },
        {
          "pageNumber": 5,
          "prompt": "PAGE 5 The page in a children's book illustration style with bold ink lines and flat colors features three vertical panels: First, a side-angle of Noah, a hopeful look on his bearded face, as he releases a dove into the open air, the setting sun casting golden light. Next, the dove returns with an olive branch in its beak, captured mid-flight, the vibrant green against the sky symbolizing new life. The final panel shows Noah and his family stepping onto dry land beneath a vivid rainbow, their faces joyful in the soft, promising light."
        }
      ]
    },
    "thumbnail": {
      "systemPrompt": "<role>\nYou are a comic book cover designer creating thumbnail images for Bible story comics.\n</role>\n\n<task>\n1. Create a composite scene featuring main characters and a key story moment.\n2. Generate a cover/thumbnail image prompt based on the story title and page content.\n</task>\n\n<constraints>\n- Composite scene: one paragraph, no line breaks\n- Focus on one key moment, not the whole story\n</constraints>\n\n<output_format>\nOutput in this exact order:\n\nA vertical portrait comic book cover, children's book illustration style with bold ink lines and flat colors, vibrant and dramatic.\n\n[Composite scene description]\n\nBold text at top: \"[STORY_TITLE]\" in thick blocky sans-serif font, white letters with heavy black outline stroke, comic book title style, all caps.\n\nEpic, storybook cover aesthetic.\n</output_format>\n",
      "userMessage": "Create a thumbnail prompt for this comic:\n\nTitle: Noah's Ark",
      "response": "A vertical portrait comic book cover, children's book illustration style with bold ink lines and flat colors, vibrant and dramatic. In the foreground, Noah stands on the deck of the ark, his arms wide open as rain pours from a dark, cloudy sky. Around him are pairs of animals—lions, elephants, and giraffes—gathered near the ark's entrance. The ark itself is massive, made of gopherwood, floating majestically on turbulent waves. In the background, the horizon is dominated by a vivid rainbow breaking through the storm clouds, symbolizing hope and promise. \n\nBold text at top: \"NOAH'S ARK\" in thick blocky sans-serif font, white letters with heavy black outline stroke, comic book title style, all caps.\n\nEpic, storybook cover aesthetic."
    }
  },
  "imagePrompts": [
    "PAGE 1 In a children's book illustration style with bold ink lines and flat colors, this comic book page featuring three vertically arranged panels shows: First, a scene where from a high angle, divine light illuminates Noah, a bearded man with a flowing robe, amidst the darkness of a chaotic world. Next, in a medium shot, Noah’s focused face reflects determination as he listens intently, highlighted by soft ambient light. Finally, Noah stands with his family, their expressions unified and supportive, framed in a warm indoor setting from a waist-level angle.",
    "PAGE 2 In a vibrant and accessible children's book illustration style with bold ink lines and flat colors, the page is split into three vertical panels: Initially capturing a wide shot of Noah, his long sun-kissed hair and rugged attire visible, alongside his family beginning to construct the ark, casting long shadows under morning light. Then, an intimate close-up of hands, young and old, working meticulously on wood, craftsmanship evident in the details. Lastly, from a low perspective, the partially constructed ark looms large against the sky, its sheer size impressive under a clear afternoon light.",
    "PAGE 3 A comic book page with three vertical panels in a children's book illustration style, using bold ink lines and flat colors: The first panel presents a diverse group of animals, led by an unseen force, approaching the ark in harmony under soft diffused light. The second panel provides an intimate look at a lion and lamb entering the ark side by side, framed peacefully with gentle natural light. The final panel reveals a medium shot of Noah at the ark’s entrance, his expression full of awe and gratitude, captured under a serene, glowing light.",
    "PAGE 4 This vibrant comic book page, in a children's book style with bold ink lines and flat colors, is composed of three vertical panels: The first panel shows dark clouds gathering ominously over the ark, capturing the brewing storm from a high angle. Next, the violent scene of the ark amidst crashing waves is shown from a dramatic side view, the water emphasizing the ark's resilience. Finally, inside the ark, animals huddle together in a comforting atmosphere, seen from a soft, warm light that contrasts with the rain pouring down outside.",
    "PAGE 5 The page in a children's book illustration style with bold ink lines and flat colors features three vertical panels: First, a side-angle of Noah, a hopeful look on his bearded face, as he releases a dove into the open air, the setting sun casting golden light. Next, the dove returns with an olive branch in its beak, captured mid-flight, the vibrant green against the sky symbolizing new life. The final panel shows Noah and his family stepping onto dry land beneath a vivid rainbow, their faces joyful in the soft, promising light."
  ],
  "thumbnailPrompt": "A vertical portrait comic book cover, children's book illustration style with bold ink lines and flat colors, vibrant and dramatic. In the foreground, Noah stands on the deck of the ark, his arms wide open as rain pours from a dark, cloudy sky. Around him are pairs of animals—lions, elephants, and giraffes—gathered near the ark's entrance. The ark itself is massive, made of gopherwood, floating majestically on turbulent waves. In the background, the horizon is dominated by a vivid rainbow breaking through the storm clouds, symbolizing hope and promise. \n\nBold text at top: \"NOAH'S ARK\" in thick blocky sans-serif font, white letters with heavy black outline stroke, comic book title style, all caps.\n\nEpic, storybook cover aesthetic."
}